<?xml version="1.0" encoding="UTF-8"?>
<RestaurantCuisineMapList xmlns:xsi="http://www.w3.org/2001/XMLSchema-instance" xmlns="http://www.example.org/RestaurantCuisineMapFinder" xsi:noNamespaceSchemaLocation="RestaurantCuisineMap.xsd">
	<RestaurantCuisineMap>
		<Id>1</Id>
		<RestaurantId>1</RestaurantId>
		<CuisineId>2</CuisineId>
	</RestaurantCuisineMap>
	<RestaurantCuisineMap>
		<Id>2</Id>
		<RestaurantId>2</RestaurantId>
		<CuisineId>2</CuisineId>
	</RestaurantCuisineMap>
</RestaurantCuisineMapList>
